,Phrase
447,I argued with people. I'm not very agreeable or polite. | speak my mind. 
448,"As I said, these were all people who "
449,did things for a few months or at worst a few years. 
450,"Not murderers or informers. As I said, people who made up ideas about Hitler. "
451,But the greatest experience when one returns to Germany 
452,"apart from the experience of recognition, "
453,which is always the crux of the act in Greek tragedy... 
454,The greatest experience is one of emotional upheaval. 
455,Second was that German was spoken on the street. That pleased me beyond words. 
456,— This reaction was in 1949? — More or less. 
457,"And today, now that things are back on track, "
458,"And today, now that things are back on track, "
459,the distance has become greater than when in that emotional upheaval. 
460,— Because the conditions in the country got back on track too fast in your view? 
461,— Yeah and often on a track which I don't approve of. 
462,
463,"That is, I'm far less involved than I was then. "
464,It could also be due to the lapse of time. 15 years is not nothing! 
465,"But would you say, to summarize it in one expression as far as possible, "
466,"Yeah, distance. Indifference is too strong. But there's distance. "
467,This fall your book on the Eichmann trial in Jerusalem was published in West Germany. 
468,This work has been very fiercely debated since its publication in the U.S. 
469,The Jewish side especially has raised objections against the book that you say 
470,are partly due to misunderstandings and also a controlled political campaign. 
471,"Above all, people were upset by the question you raised about "
472,"the extent the Jews are to blame for their passive acceptance in the murder campaign, "
473,"or what is the more significant part in the book, "
474,to what extent the collaboration of certain Jewish councils 
475,is almost a kind of complicity of its own. 
476,"In any case, for a portrait of Hannah Arendt, "
477,it seems to me there are several questions that arise from this book. 
478,A Rem oly sta esi Is it painful for you 
479,that your book is accused of a lack of love for the Jewish people? 
480,"First of all, let me say, TIME UM ca Coren ote "
481,you yourself have been a victim of this campaign. 
482,Nowhere in my book did I accuse the Jewish people of not resisting. 
483,"Namely, Mr. Haussner of the Israeli public prosecutor's office. "
484,I called the questions he directed at the witnesses in Jerusalem: 
485,But some of the accusations against you are based on 
486,aim ROT UOMUANTCe Tm IECOh a OER hdcwe-Teomn ae LAK te 
487,I can't say anything against that. And I don't want to. 
488,
489,Or let's put it differently. I don't want to get combative. 
490,"— You get combative? — No, what's the point? "
491,"Look, there are people who take offense. "
492,"That is, I can still laugh. "
493,And I really thought that Eichmann was a clown. 
494,"I read his police interrogation, 3,600 pages, and very carefully. "
495,And I don't know how many times I laughed out loud! 
496,"Now, this reaction offended people. "
497,I cannot help that. But I do know one thing. 
498,The tone is largely ironic. 
499,The tone is really the person in this case. 
500,"So when people reproach me with accusing the Jewish people, "
501,that is a malicious propaganda lie and nothing else. 
502,"The tone, however, is an objection against me personally. I can't help that. "
503,What are you supposed to do? You cannot do anything. 
504,I can't tell people: you misunderstand me and in my heart is really this or that. 
505,"In this context, I'd like to go back to a personal statement you made. "
506,"""I've never in my life loved any people or collective group,"" "
507,"""neither Germans, nor French, nor Americans,"" "
508,"""In fact, I only love my friends."" "
509,"""I'm entirely incapable of any other kind of love.” "
510,"""In particular, the love of the Jews"" "
511,"""would be suspect since I am myself Jewish."" "
512,"As justified & respectable as this attitude may be, "
513,"does not man, as a politically active being, need a commitment to a group? "
514,A commitment that can then to some extent be called love? 
515,Do you not worry that your attitude could be politically sterile? 
516,"No, I'd say the other is politically sterile. "
517,We could have a long colloquium on this. 
518,"To belong to a group, in the first place, is a natural condition. "
519,
520,"Now, to belong to a group in this second sense you mean, "
521,that’s something entirely different. 
522,This organization of people has to do with one's relation to the world. 
523,become organized have in common what are ordinarily called interests. 
524,"Thus what lies between them, that truly involves a relation to the world. "
525,"The direct personal relationship in which one can speak of love, "
526,"that exists, of course, first and foremost in real love, "
527,"and secondly, it exists in a sense in friendship too. "
528,"Here a person is addressed directly, independent of their relation to the world. "
529,can still be personal friends. 
530,"But if one confuses these things, "
531,"if one brings love to the negotiating table, "
532,And I really find it to be a very great disaster. 
533,And I admit that the Jewish people are a prime example of 
534,a worldless people who maintained themselves for thousands of years. 
535,— 'World' is understood in your terminology as the realm for politics? 
536,— As the realm for politics and also the public realm. 
537,— Jews were an apolitical people? 
538,"I wouldn't exactly say that, since the communities were naturally also political. "
539,BU het) canes (onl is a national religion. 
540,"One can't say ‘apolitical’, but it's only political with very great restrictions. "
541,"This worldnessless that the Jewish people suffered in being dispersed, "
542,"as with all people who are pariahs, "
543,
544,This changed the moment when Israel was founded. 
545,"Actually, it already did with the national Jewish home in Palestine. "
546,— Has something been lost which you regret? 
547,"Yes, you pay dearly for freedom. "
548,The specific Jewish humanity [signified by their lack of a homeland] 
549,The specific Jewish humanity [signified by their lack of a homeland] 
550,was quite beautiful. You're too young to have experienced it. But it was lovely. 
551,This standing outside all social connections. 
552,"which I experienced very strongly with my mother, "
553,who also practiced it in relation to the whole Jewish community. 
554,All that charm was of course lost. 
555,—I said in my Lessing speech: — 1959. 
556,This humanity hasn't survived the day of liberation by as much as 5 minutes. 
557,"You see, that also happened to us. "
558,No. I know you have to pay a price for freedom. 
559,"Mrs. Arendt, if you acquire knowledge via political-philosophical speculation "
560,do you feel so committed to it that it is your duty to publish it? 
561,Or do you recognize reasons to be silent about a known truth? 
562,"Yes, that's a very difficult problem. "
563,At bottom that's the only question 
564,which interested me in the whole controversy over the Eichmann book. 
565,But it's a question that never arose unless I broached it. 
566,It's the only serious question. All else is pure propaganda soup. 
567,"""Let truth be told, though the world may perish""? "
568,"Well, the Eichmann book did not de facto touch upon such things. "
569,The book basically did not actually jeopardize anyone's legitimate interests. 
570,"Yeah, you're right. "
571,What counts as 'legitimate' is open to discussion. 
572,I probably mean something different by MTL ebeeE Comm ASL VOM AICIN oh SESIMC Ee LEAT SCOT e 
573,I probably mean something different by ‘legitimate’ than the Jewish organization. 
574,"one's genuine interests, which even I recognize, were at play. "
575,— Can one then be silent about a recognized truth? 
576,Would I have done so? I would've written it... 
577,"if I had anticipated this or that, "
578,would I not have written the Eichmann book differently? 
579,I would've faced the alternative: to write or not to write. 
580,You can hold your tongue. You don't always have to speak. 
581,But now we come to the question 
582,"ILM TT mem Rls e were called ""truths of fact"". "
583,"This case is really a matter of truths of fact, not of opinion. "
584,Historical sciences are the guardians of these truths of fact in the universities. 
585,They're controlled by the state. 
586,I was told that a historian remarked about a book on the origins of WWI: 
587,"""I won't let it spoil the memory of such an uplifting time!"" "
588,So that is a man who doesn't know who he is. But that's uninteresting. 
589,"De facto he is the guardian of historical truths, the truths of fact. "
590,"And we know how important these guardians are, "
591,"for example, from Bolshevik history, where history is rewritten every 5 years. "
592,"And the facts remain unknown, such as there was a Mr. Trotsky. "
593,Is this what we want? Is this what governments have an interest in? 
594,— Perhaps. But do they have that right? 
595,They don't appear to believe they do themselves. 
596,Otherwise they wouldn't tolerate universities at all. 
597,"So, even states themselves have an interest in the truth. "
598,I don't mean military secrets. That's a different matter. 
599,"Well, these events go back about 20 years. "
600,"Yeah, some say that. "
601,And others say that after 20 years one no longer can find out the truth. 
602,"In any case, there is an interest in whitewashing. "
603,But that isn't a legitimate interest. 
604,"Thus, in case of doubt, you would prefer the truth? "
605,"I would say that impartiality, which came into the world when Homer... "
606,"— ""For the conquered as well"" — Yes! ""If the voices of song are silent"" "
607,That's what Homer did. 
608,"""the great deeds of the Greeks and the barbarians..."" "
609,"All science comes from this spirit, "
610,even modern science and also history. 
611,If one is incapable of this impartiality 
612,because one pretends to love one's own people so much that 
613,— One conceals the truth? — Yes or constantly flatters... 
614,"one constantly pays flattering homage to them, "
615,then nothing can be done. I don't think people like that are patriots. 
616,"In one of your most important works, The Human Condition, "
617,you come to the conclusion that the modern period has 
618,"dethroned the community spirit, i.e. the prime sense of importance of the political. "
619,You designate as modern social phenomena 
620,"the uprooting and loneliness of the masses, "
621,and the triumph of a type of person who 
622,I have two questions about this. 
623,"First, to what extent are such philosophical insights "
624,dependent on personal experiences which get the thought process going? 
625,I don't think any thought process is possible without personal experience. 
626,"That is, every thought is an afterthought, "
627,a reflection on some matter or event. 
628,And obviously my experiences are in and of the modern world. 
629,"This, by the way, has been pointed out by many others. "
630,"You see, the matter of labor and consumption "
631,"on my account are only two sides of the same phenomenon, "
632,"that is, this cycle in which life oscillates, "
633,That again is the reason why it's so 
634,"important, and it seems to me, ominous "
635,because a kind of worldlessness could again form itself there. 
636,It no longer matters how the world appears. 
637,—'World' always understood as the space in which politics can occur? 
638,I understand it now in a wider sense: 
639,"as the space in which one lives, "
640,"in which art of course appears, "
641,in which all kinds of things appear. 
642,You remember Kennedy had tried 
643,to expand the public space by inviting 
644,poets and good-for-nothings into the White House. 
645,So that it all could belong to this space. 
646,"In labor and consumption though, man is utterly thrown back on himself. "
647,On the biological and on himself. 
648,And there you have the connection with loneliness. 
649,In the process of labor a curious loneliness arises. 
650,"I can't go into that now, it would take us too far afield. "
651,"And this loneliness consists in being thrown back upon oneself, "
652,"where, in a sense, consumption takes the place of all truly relating activities. "
653,you come to the conclusion that 
654,"""truly world oriented experiences” "
655,meaning insights & experiences of the highest political status 
656,"eater eter tetera tierce ite  the experiential horizon of the average human existence."" "
657,"This most important aspect of human existence, "
658,"as you say, ""the ability to act"", ""1s today restricted to a few."" "
659,What does this mean in practical terms of politics? 
660,To what extent in these circumstances does a form of government theoretically 
661,based on the co-responsibility of all citizens become a fiction? 
662,"You see, first of all, "
663,this inability to be truly oriented 
664,"applies not only to the masses, but every other stratum of society. "
665,"encircled by an army of experts, "
666,"And actually, the question of action here "
667,is between the statesman and the experts. 
668,The statesman has to make the final decision. 
669,"He can hardly do that realistically, since he can't know everything himself. "
670,from experts who in principle 
671,always must contradict each other. 
672,Every reasonable statesman gets opposing expert opinions. 
673,He has to judge between them. 
674,And this judging is a extremely mysterious process 
675,in which the community spirit is then to be expressed. 
676,"Now, as far as the masses are concerned, I would say: "
677,"it doesn't matter the size, "
678,and the public sphere is formed. 
679,"And in America, where there are still these spontaneous associations, "
680,Some public interests concern 
681,or some other sort of group. 
682,Then these people will get together and be very good 
683,at being able to act publicly in these matters since they oversee them. 
684,"That is, what you said only applies to the greatest decisions at the highest level. "
685,"And there, believe me, the difference between the statesman "
686,"You don't have to believe me, I only said it rhetorically. "
687,"Ms. Arendt, Karl Jaspers is your former teacher who "
688,you've been particularly close with as a constant dialogue partner among friends. 
689,What do you think is the greatest influence Jaspers has had on you? 
690,
691,an unconditionality of speaking 
692,that I've never known in another person. 
693,
694,He also has a concept of freedom linked to reason 
695,which was completely foreign to me when I came to Heidelberg. 
696,
697,"I saw this reason in action, so to speak. "
698,"If I may say so, I grew up without a father, and I was educated by it. "
699,"Or if you like...I don't want to make him responsible for me for God's sake, "
700,"Or if you like...I don't want to make him responsible for me for God's sake, "
701,then this was Karl Jaspers. 
702,"And this dialogue, of course, is very different today. "
703,That was actually my most powerful post-war experience. 
704,In a speech on Jaspers you said: 
705,"""Humanity is never acquired in solitude"" "
706,"“and never by giving one's work over to the public."" "
707,"""Only by throwing one's life & person into the venture into the public sphere"" "
708,means what to Hannah Arendt? 
709,One exposes oneself 
710,"to the light of the public, as a person. "
711,Although I am of the opinion that 
712,"one must not self-consciously appear and act in public, "
713,still I know that in every action the person 
714,is expressed in a way like no other 
715,— like no other activity. 
716,So that's one venture. The second is: 
717,"we weave our thread in a network of relationships, "
718,We've all been taught to say: 
719,This is true of all action. 
720,"Quite simply and concretely true, "
721,this venture is only possible 
